Lokasi;Jadwal;Alamat
"KORAMIL TRUCUK";"2024-05-22 08:00:00";"Desa Sumberrejo Kec. Trucuk Bojonegoro"
"SMA NEGERI KEDUNGADEM";"2024-05-22 08:00:00";KEDUNGADEM
"KORAMIL KAPAS";"2024-05-22 08:00:00";"Jl. Raya Kapas Kec. Kapas Bojonegoro"
"PT. PNM CAB. BOJONEGORO";"2024-05-25 07:00:00";"JL DR SUHARSO MOJOKAMPUNG BOJONEGORO"
"DESA KESONGO ";"2024-05-25 09:00:00";KEDUNGADEM
"PSHT RANTING KEPOHBARU";"2024-05-25 18:00:00";"Jl. Raya Kepohbaru Bojonegoro"
"KLINIK ZAM ZAM";"2024-05-27 10:00:00";BOJONEGORO
"KLINIK ZAMZAM NGRAHO";"2024-05-27 14:00:00";"Jl. Ngraho-ngawi Kalirejo Ngraho Bojonegoro"
