Lokasi;Jadwal;Alamat
"KORAMIL MARGOMULYO";"2024-05-16 07:00:00";"Kalimojo Kec. Gondang"
"DESA SAMBENG KEC. KASIMAN";"2024-05-16 08:00:00";"BALAI DESA SAMBENG "
"BPBD BOJONEGORO";"2024-05-17 07:00:00";"JL. A YANI BOJONEGORO"
"SKT UNIT MPS KALITIDU ( PT BAROKAH ANGLING DARMO )";"2024-05-17 08:00:00";"JL RAYA KALITIDU."
"PRAKTEK DR. MELANI (BAKUNG, KANOR - BOJONEGORO)";"2024-05-17 14:00:00";
"KODIM 0813 BOJONEGORO";"2024-05-18 07:00:00";"JL. HOS COKROAMINOTO - BOJONEGORO"
"KLINIK MUHAMMADIYAH KEDUNGADEM";"2024-05-18 08:00:00";"JL RAYA KEDUNG ADEM"
"PSHT RANTING PURWOSARI - BOJONEGORO";"2024-05-18 18:00:00";
