Lokasi;Jadwal;Alamat
"RSI MUHAMMADIYAH - SUMBEREJO";"2025-09-27 08:00:00";"JL. RAYA SUMBEREJO NO. 1193"
"PRAKTEK BIDAN FITRIA";"2025-09-27 08:00:00";"Ds. Balongsumber Dander"
"GPDI ALFA OMEGA BOJONEGORO";"2025-09-28 07:00:00";"JL HAYAM WURUK - BOJONEGORO"
"KLINIK ZAM ZAM Kalitidu";"2025-09-29 08:00:00";"Jl. Bojonegoro - Ngawi 174a Kalitidu"
"KLINIK ZAMZAM NGRAHO";"2025-09-29 13:00:00";"Jl. Ngraho-ngawi Kalirejo Ngraho Bojonegoro"
"GP ANSOR BUMIAYU BAURENO";"2025-09-29 18:00:00";BAURENO
"PUSKESMAS KEC. PURWOSARI ";"2025-09-30 08:00:00";"Jl. Raya Purwosari"
