Lokasi;Jadwal;Alamat
"DESA SAMBENG KEC. KASIMAN";"2023-10-17 08:00:00";"BALAI DESA SAMBENG "
"SMK NEGERI 3 BOJONEGORO";"2023-10-17 08:30:00";"JL P.POLIM NO- BOJONEGORO"
"PUSKESMAS KEC. PURWOSARI ";"2023-10-18 08:00:00";"Jl. Raya Purwosari"
"SKT UNIT MPS KAPAS - BOJONEGORO";"2023-10-18 08:00:00";"JL RAYA KAPAS -"
"PT PERTAMINA EP CEPU ( PEPC )";"2023-10-19 07:00:00";
"DESA SITIAJI KEC. SOKOSEWU";"2023-10-19 08:00:00";"JL. RAYA SUKOSEWU"
"SMA NEGERI 4 BOJONEGORO";"2023-10-20 07:30:00";"JL. AKBP. MSUROKO NO. 30 BOJONEGORO"
